cell_line,tissue,pmid,pmcid,paper_title,is_free_access,paper_url,search_timestamp,myc_summary,direct_quote,model_used
T47D,breast,24051023,,Physalin F from Physalis minima L. triggers apoptosis-based cytotoxic mechanism in T-47D cells through the activation caspase-3- and c-myc-dependent pathways.,no,https://pubmed.ncbi.nlm.nih.gov/24051023/,2026-04-20T20:56:46.579518+00:00,"[Abstract only] In T47D cells, physalin F treatment co-regulated the expression of c-myc and caspase-3-apoptotic genes, leading to apoptosis via activation of these pathways.","mRNA expression analysis revealed the co-regulation of c-myc- and caspase-3-apoptotic genes in the treated cells with the peak expression at 9 and 12h of treatment, respectively.",llama3.1:8b
T47D,breast,8497271,PMC359827,"Growth factor, steroid, and steroid antagonist regulation of cyclin gene expression associated with changes in T-47D human breast cancer cell cycle progression.",yes,https://pubmed.ncbi.nlm.nih.gov/8497271/,2026-04-20T20:56:47.442015+00:00,Both antiestrogen and antiprogestin depleted c-myc mRNA by > 80% within 2 h. These data suggest the involvement of both cyclin D1 and c-myc in the steroidal control of breast cancer cell cycle progression.,These data suggest the involvement of both cyclin D1 and c-myc in the steroidal control of breast cancer cell cycle progression.,llama3.1:8b
T47D,breast,40708058,PMC12291396,"The potential mechanism of Saikosaponin D against luminal A breast cancer based on bioinformatical analysis, molecular docking and in vitro studies.",yes,https://pubmed.ncbi.nlm.nih.gov/40708058/,2026-04-20T20:56:48.404597+00:00,"This study found that Saikosaponin D (SSD) can affect the proliferation, cell cycle distribution, and apoptosis of luminal A breast cancer cells. The results suggest that SSD may exert its anti-breast cancer effects via ESR1 and the downstream targets CCND1 and c-Myc.","Our findings highlight the anticancer potential of SSD, emphasising its ability to selectively target luminal A breast cancer cells.",llama3.1:8b
T47D,breast,20150224,,"Apoptotic effects of Physalis minima L. chloroform extract in human breast carcinoma T-47D cells mediated by c-myc-, p53-, and caspase-3-dependent pathways.",no,https://pubmed.ncbi.nlm.nih.gov/20150224/,2026-04-20T20:56:48.904480+00:00,"[Abstract only] The chloroform extract of Physalis minima induced apoptotic cell death in T47D cells via c-myc-dependent pathways, as well as p53- and caspase-3-dependent pathways. The c-myc gene was significantly induced by the extract at an earlier phase of treatment.","Thus, the results from this study strongly suggest that the chloroform extract of P. minima induced apoptotic cell death via p53-, caspase-3-, and c-myc-dependent pathways.",llama3.1:8b
T47D,breast,38426579,PMC10914311,Cytoplasmic localization of SETDB1‑induced Warburg effect via c‑MYC‑LDHA axis enhances migration and invasion in breast carcinoma.,yes,https://pubmed.ncbi.nlm.nih.gov/38426579/,2026-04-20T20:56:49.940774+00:00,"The study investigates the role of cytoplasmic SETDB1 in breast cancer (BC) metastasis, migration, epithelial-to-mesenchymal transition (EMT), and metabolic reprogramming. The results show that cytoplasmic SETDB1 is associated with BC metastasis and its function can be blocked by a CRM1 inhibitor.","The present study demonstrated that cytoplasmic SETDB1 was associated with BC metastasis and the function of cytoplasmic SETDB1 in migration, EMT and metabolic reprogramming was blocked by a CMR1 inhibitor.",llama3.1:8b
T47D,breast,15619555,,Growth arrest and non-apoptotic programmed cell death associated with the up-regulation of c-myc mRNA expression in T-47D breast tumor cells following exposure to Epipremnum pinnatum (L.) Engl. hexane extract.,no,https://pubmed.ncbi.nlm.nih.gov/15619555/,2026-04-20T20:56:49.941418+00:00,"[Abstract only] In T47D cells, Epipremnum pinnatum hexane extract increased c-myc mRNA expression, which may have contributed to growth arrest and Type II non-apoptotic programmed cell death.",These findings suggested that up-regulation of c-myc mRNA expression may have contributed to the growth arrest and Type II non-apoptotic programmed cell death in the Epipremnum pinnatum (L.) Engl. hexane extract-treated T-47D cells.,llama3.1:8b
T47D,breast,36420790,,Quantitative flow cytometry leveraging droplet-based constriction microchannels with high reliability and high sensitivity.,no,https://pubmed.ncbi.nlm.nih.gov/36420790/,2026-04-20T20:56:50.442170+00:00,"[Abstract only] In T47D cells, c-Myc protein expression was quantified as 2.08 ± 0.13 × 10^6.","single-cell expressions of Ras, c-Myc, and β-tubulin were quantified",llama3.1:8b
T47D,breast,36042494,PMC9426012,S6K1 amplification confers innate resistance to CDK4/6 inhibitors through activating c-Myc pathway in patients with estrogen receptor-positive breast cancer.,yes,https://pubmed.ncbi.nlm.nih.gov/36042494/,2026-04-20T20:56:51.636780+00:00,The study found that S6K1 amplification is associated with innate resistance to CDK4/6 inhibitors in ER+ HER2- breast cancer. The authors propose a potential therapeutic strategy of combining mTOR inhibitors with CDK4/6 inhibitors for patients with S6K1 amplification.,"In summary, S6K1 amplification occurred frequently in patients with ER+ MBC, could be detected by ctDNA analysis, and was closely related to the innate resistance of CDK4/6 inhibitors.",llama3.1:8b
T47D,breast,23770854,PMC4267223,Loss of N-Myc interactor promotes epithelial-mesenchymal transition by activation of TGF-β/SMAD signaling.,yes,https://pubmed.ncbi.nlm.nih.gov/23770854/,2026-04-20T20:56:52.157314+00:00,"The paper discusses the role of Myc in regulating cell growth, proliferation, and apoptosis. It highlights the importance of Myc in cancer development and its potential as a therapeutic target.","Myc is a transcription factor that regulates cell growth, proliferation, and apoptosis by binding to specific DNA sequences.",llama3.1:8b
T47D,breast,23145106,PMC3493498,Cohesin is required for activation of MYC by estradiol.,yes,https://pubmed.ncbi.nlm.nih.gov/23145106/,2026-04-20T20:56:53.344053+00:00,"The paper discusses the role of RAD21 in regulating MYC gene expression. The authors show that RAD21 is required for estrogen-induced activation of the MYC promoter, and that depletion of RAD21 reduces MYC expression.",RAD21 chromatin binding was analyzed using ChIP.,llama3.1:8b
T47D,breast,37860544,PMC10582296,Knockdown of LINC00702 inhibits the growth and induces apoptosis of breast cancer through the Wnt/β-catenin pathway.,yes,https://pubmed.ncbi.nlm.nih.gov/37860544/,2026-04-20T20:56:54.223884+00:00,This study found that LINC00702 is an oncogenic lncRNA that promotes proliferation and suppresses apoptosis in breast cancer cells via the Wnt/β-catenin pathway.,LINC00702 mediates DUSP1 transcription to prevent bladder cancer progression.,llama3.1:8b
T47D,breast,11355743,,Gene amplification and expression of the steroid receptor coactivator SRC3 (AIB1) in sporadic breast and endometrial carcinomas.,no,https://pubmed.ncbi.nlm.nih.gov/11355743/,2026-04-20T20:56:54.224706+00:00,[Abstract only] MYC not discussed for this cell line in this paper,,llama3.1:8b
T47D,breast,18550772,PMC2505329,"Signal transducer and activator of transcription 5b, c-Src, and epidermal growth factor receptor signaling play integral roles in estrogen-stimulated proliferation of estrogen receptor-positive breast cancer cells.",yes,https://pubmed.ncbi.nlm.nih.gov/18550772/,2026-04-20T20:56:55.031782+00:00,"In T47D cells, E2 treatment increased c-myc mRNA expression, which was inhibited by STAT5b knockdown or overexpression of a kinase-defective EGFR.",EGFR and c-Src kinase activities were also required for E2-induced cyclin D1 and c-myc mRNA.,llama3.1:8b
T47D,breast,9652748,,Inhibition of the MAP kinase cascade blocks heregulin-induced cell cycle progression in T-47D human breast cancer cells.,no,https://pubmed.ncbi.nlm.nih.gov/9652748/,2026-04-20T20:56:55.032873+00:00,"[Abstract only] HRG stimulation led to sequential induction of c-myc gene expression, and preincubation with PD98059 blocked the HRG-dependent induction of c-Myc protein.",These findings demonstrate that MEK activation is critical to HRG-induced S-phase entry in these cells whilst PI3-kinase plays a minor role.,llama3.1:8b
T47D,breast,37436061,,Loss of miR-6844 alters stemness/self-renewal and cancer hallmark(s) markers through CD44-JAK2-STAT3 signaling axis in breast cancer stem-like cells.,no,https://pubmed.ncbi.nlm.nih.gov/37436061/,2026-04-20T20:56:55.530407+00:00,"[Abstract only] Loss of miR-6844 significantly altered the expression of c-Myc, along with other stemness and self-renewal markers (Bmi-1, Nanog, Sox2, and CD44), in mammosphere derived from T47D cells.","Loss of miR-6844 significantly altered stemness and self-renewal markers (Bmi-1, Nanog, c-Myc, Sox2, and CD44) in mammosphere compared to negative control spheres.",llama3.1:8b
HCC1187,breast,NA,,No MYC-related papers found,NA,,2026-04-20T20:56:55.640281+00:00,,,
UACC893,breast,11343771,,"Aberrations of chromosome 8 in 16 breast cancer cell lines by comparative genomic hybridization, fluorescence in situ hybridization, and spectral karyotyping.",no,https://pubmed.ncbi.nlm.nih.gov/11343771/,2026-04-20T20:56:56.749311+00:00,"[Abstract only] Extra copies of the C-MYC oncogene were found in 11 cell lines, including UACC893, but high-level amplification only in SK-BR-3.",,llama3.1:8b
HCC1428,breast,26116361,,AKT Antagonist AZD5363 Influences Estrogen Receptor Function in Endocrine-Resistant Breast Cancer and Synergizes with Fulvestrant (ICI182780) In Vivo.,no,https://pubmed.ncbi.nlm.nih.gov/26116361/,2026-04-20T20:56:58.293900+00:00,"[Abstract only] Global gene expression highlighted ERBB2-ERBB3, ERK5, and IGFI signaling pathways driven by MYC as potential feedback-loops.",,llama3.1:8b
HCC1143,breast,35837063,PMC9257941,3-Bromopyruvic acid regulates glucose metabolism by targeting the c-Myc/TXNIP axis and induces mitochondria-mediated apoptosis in TNBC cells.,yes,https://pubmed.ncbi.nlm.nih.gov/35837063/,2026-04-20T20:57:00.065344+00:00,"The study found that 3-Bromopyruvic Acid (3-BrPA) inhibited TNBC cell proliferation by targeting the c-Myc/TXNIP axis, downregulating c-Myc and upregulating TXNIP. This effect was stronger in cells with high c-Myc/low TXNIP expression.",The results obtained by different teams were dissimilar despite the same drug and the same cell line being used.,llama3.1:8b
HCC1569,breast,20836878,PMC2945963,t-DARPP regulates phosphatidylinositol-3-kinase-dependent cell growth in breast cancer.,yes,https://pubmed.ncbi.nlm.nih.gov/20836878/,2026-04-20T20:57:01.902437+00:00,"The paper discusses the role of truncated dopamine and cyclic-AMP-regulated phosphoprotein of Mr 32,000 (DARPP-32) in breast cancer. The authors found that DARPP-32/t-DARPP protein(s) expression was high in tumor tissue compared to adjacent normal tissue. They also showed that t-DARPP expression was associated with invasive ductal carcinoma and other types of carcinomas.","The results indicated that 8 (42.1%) tumors exhibited relatively higher t-DARPP expression than DARPP-32, as shown by stronger immunostaining with C-DARPP-32 than N-DARPP-32.",llama3.1:8b
CAL51,breast,30066852,PMC6086626,Upregulation of PD‑L1 expression by resveratrol and piceatannol in breast and colorectal cancer cells occurs via HDAC3/p300‑mediated NF‑κB signaling.,yes,https://pubmed.ncbi.nlm.nih.gov/30066852/,2026-04-20T20:57:03.884423+00:00,"This study investigated the effect of resveratrol and piceatannol on PD-L1 expression in cancer cells. The results showed that both compounds upregulated PD-L1 expression, with a synergistic effect when used together. The induction of PD-L1 was found to be mediated through the NF-κB signaling pathway. Additionally, high doses of resveratrol and piceatannol were shown to induce cell cycle arrest and apoptosis in cancer cells.",The upregulation of membrane-associated PD-L1 in low PD-L1-expressing tumor cells is a 'find-me' approach for targeting by immune checkpoint inhibitors to potentially improve the efficacy of anti-PD-L1 blockade therapy via stilbenoids.,llama3.1:8b
HCC1937,breast,33832512,PMC8028839,Efficacy and mechanism of the combination of PARP and CDK4/6 inhibitors in the treatment of triple-negative breast cancer.,yes,https://pubmed.ncbi.nlm.nih.gov/33832512/,2026-04-20T20:57:06.133005+00:00,"The study found that the combination of olaparib (a PARP inhibitor) and palbociclib (a CDK4/6 inhibitor) synergistically inhibits the growth of BRCA-mutant triple-negative breast cancer cells, providing a new treatment opportunity for certain TNBCs.",The development of PARPi resistance in BRCA mut cancers is a pressing clinical problem.,llama3.1:8b
HCC1937,breast,33850556,PMC8027724,Diclofenac impairs the proliferation and glucose metabolism of triple-negative breast cancer cells by targeting the c-Myc pathway.,yes,https://pubmed.ncbi.nlm.nih.gov/33850556/,2026-04-20T20:57:06.962412+00:00,"Diclofenac can decrease the protein expression of GLUT1 and HK activity in cancer cells by downregulating the expression of c-Myc, lowering glucose uptake, preventing the supply of energy and inhibiting glycolysis, eventually inhibiting the growth of TNBC cells.",The use of glycolysis inhibitors alone or in combination with chemotherapeutic drugs has been currently proposed in the clinic.,llama3.1:8b
HCC1937,breast,39672097,PMC11697786,circUBR5 promotes ribosome biogenesis and induces docetaxel resistance in triple-negative breast cancer cell lines via the miR-340-5p/CMTM6/c-MYC axis.,yes,https://pubmed.ncbi.nlm.nih.gov/39672097/,2026-04-20T20:57:07.963974+00:00,"The study investigates the molecular mechanisms of docetaxel (DTX) chemoresistance in triple-negative breast cancer (TNBC). It identifies CMTM6 as a key regulator of c-MYC-mediated ribosome biogenesis, and shows that its knockdown can suppress proliferation, promote apoptosis, and increase sensitivity to DTX. The study also reveals that circUBR5 acts as a ceRNA to sponge miR-340-5p and upregulate CMTM6 expression.","The domains of c-MYC protein structure is essentially disordered and short of an enzymatically-active site, which pose difficulties for drug design and make it still challenging to target c-MYC with clinical-grade small molecules, particularly at the protein level.",llama3.1:8b
HCC1937,breast,39258222,PMC11385694,"Synergistic Effect of Ubiquitin-Specific Protease 14 and Poly(ADP-Ribose) Glycohydrolase Co-Inhibition in BRCA1-Mutant, Poly(ADP-Ribose) Polymerase Inhibitor-Resistant Triple-Negative Breast Cancer Cells.",yes,https://pubmed.ncbi.nlm.nih.gov/39258222/,2026-04-20T20:57:09.810466+00:00,"The study found that targeting PARG and USP14 can induce synthetic lethality in BRCA1-mutant, PARP inhibitor-resistant TNBC cells through error-prone NHEJ repair.",A balance between PARP-mediated PARylation and PARG-mediated dePARylation is vital for functional DNA DSBs.,llama3.1:8b
HCC1937,breast,23158280,,[Regulation of p14(ARF) expression and induction of cell apoptosis with c-myc in a p53-independent pathway].,no,https://pubmed.ncbi.nlm.nih.gov/23158280/,2026-04-20T20:57:09.811344+00:00,"[Abstract only] In HCC1937 cells, over-expression of wild-type c-myc up-regulates the expression of p14(ARF) in a p53-independent pathway. Wild-type c-myc is more effective than mutant c-myc at inducing apoptosis through regulation of p14(ARF)-related genes.","And cell apoptosis may be induced through the regulation of p14(ARF)-related gene, keep balance of proliferative promotion and apoptosis induction.",llama3.1:8b
HCC1937,breast,35761807,PMC9214606,"GRWD1 affects the proliferation, apoptosis, invasion and migration of triple negative breast cancer through the Notch signaling pathway.",yes,https://pubmed.ncbi.nlm.nih.gov/35761807/,2026-04-20T20:57:10.774979+00:00,"The study found that GRWD1 knockdown suppressed the proliferation, invasion, and migration of triple-negative breast cancer (TNBC) cells through the activation of the Notch signaling pathway.","In conclusion, GRWD1 knockdown suppressed the proliferation, invasion and migration and promoted the apoptosis of TNBC cells through the activation of the Notch signaling pathway.",llama3.1:8b
HCC1937,breast,30655867,PMC6312996,p53-independent role of MYC mutant T58A in the proliferation and apoptosis of breast cancer cells.,yes,https://pubmed.ncbi.nlm.nih.gov/30655867/,2026-04-20T20:57:11.654688+00:00,"The study found that the T58A mutation in MYC is unable to induce apoptosis in breast cancer cells, which may be due to its failure to suppress p21 or activate Bim. The results suggest that MYC, but not the mutant, can induce apoptosis in a p53-independent manner.",The reason why the MYC mutant is unable to promote apoptosis is unclear.,llama3.1:8b
HCC1937,breast,35251343,PMC8850966,"KIF18B promotes breast cancer cell proliferation, migration and invasion by targeting TRIP13 and activating the Wnt/β-catenin signaling pathway.",yes,https://pubmed.ncbi.nlm.nih.gov/35251343/,2026-04-20T20:57:12.513290+00:00,"The study found that KIF18B/TRIP13 axis is upregulated in breast cancer, particularly in triple-negative breast cancer (TNBC), and plays a crucial role in tumorigenesis by activating the Wnt/β-catenin signaling pathway.",KIF18B has been reported to be upregulated in BC samples and has been associated with reduced survival rates.,llama3.1:8b
HCC1937,breast,27935867,PMC5352346,The bromodomain inhibitor OTX015 (MK-8628) exerts anti-tumor activity in triple-negative breast cancer models as single agent and in combination with everolimus.,yes,https://pubmed.ncbi.nlm.nih.gov/27935867/,2026-04-20T20:57:13.509825+00:00,"The paper discusses the effects of OTX015, a small molecule inhibitor of BET proteins, on cancer cells. The results show that OTX015 inhibits cell proliferation and induces apoptosis in various cancer cell lines. The study also investigates the combination of OTX015 with other anticancer agents, such as everolimus, and finds synergistic effects. Additionally, the paper examines the effects of OTX015 on gene expression profiles and identifies potential targets for therapy.",The doubling time (Td) of each untreated tumor was calculated by exponential fit of the whole growth curve.,llama3.1:8b
HCC1937,breast,41422484,,LAT1/SLC7A5-mediated amino acid uptake is regulated by redox signals triggered by formyl-peptide receptor 2.,no,https://pubmed.ncbi.nlm.nih.gov/41422484/,2026-04-20T20:57:14.015302+00:00,"[Abstract only] In HCC1937 cells, c-Myc regulation controls LAT1/SLC7A5 synthesis at the transcriptional level.",These findings provide new approaches for the development of novel therapeutic strategies for the treatment of human cancers.,llama3.1:8b
HCC1937,breast,40730501,PMC12324995,Bufalin Suppresses Triple-Negative Breast Cancer Stem Cell Growth by Inhibiting the Wnt/β-Catenin Signaling Pathway.,yes,https://pubmed.ncbi.nlm.nih.gov/40730501/,2026-04-20T20:57:14.952610+00:00,"Bufalin, a cardiotonic steroid, has been shown to inhibit the growth of triple-negative breast cancer stem cells (TNBCSCs) by downregulating key regulatory factors, inducing apoptosis, and suppressing the Wnt/β-catenin signaling pathway.","In this study, we first evaluated the inhibitory effects of bufadienolides—specifically bufalin, bufotalin, and cinobufotalin—on the growth of TNBCSCs. Among them, bufalin demonstrated the strongest antiproliferative activity.",llama3.1:8b
HCC1937,breast,34142686,PMC8504614,Multi-omics data integration reveals correlated regulatory features of triple negative breast cancer.,yes,https://pubmed.ncbi.nlm.nih.gov/34142686/,2026-04-20T20:57:16.050982+00:00,"In HCC1937 cells, MYC is overexpressed relative to MDA-MB-231 cells, downregulating the PI3K/AKT/mTOR pathway.","We observed overexpression of PTEN, which antagonizes the PI3K/AKT/mTOR pathway, and MYC, which downregulates the same pathway in the HCC1937 cells relative to the MDA-MB-231 cells.",llama3.1:8b
HCC1937,breast,19882246,,BRCA1 transcriptionally regulates genes associated with the basal-like phenotype in breast cancer.,yes,https://pubmed.ncbi.nlm.nih.gov/19882246/,2026-04-20T20:57:17.536408+00:00,"The paper discusses the role of BRCA1 in regulating genes associated with the basal-like phenotype in breast cancer. The authors found that BRCA1 transcriptionally regulates genes involved in this phenotype, including those related to cell cycle control and DNA repair.",BRCA1 dysfunction in sporadic basal-like breast cancer.,llama3.1:8b
HCC1937,breast,34215226,PMC8254278,Breast cancer cell line toxicity of a flavonoid isolated from Baccharis densiflora.,yes,https://pubmed.ncbi.nlm.nih.gov/34215226/,2026-04-20T20:57:18.529255+00:00,"The study investigated the toxicity of three methoxy flavones isolated from B. densiflora, specifically 8-methoxycirsilineol, xanthomicrol, and sideritoflavone. The results showed that sideritoflavone was significantly more toxic than xanthomicrol, with an IC50 value of 1.9 μM in JIMT-1 cells.","The flavones 8-methoxycirsilineol, xanthomicrol, and sideritoflavone have similar structures but very different toxicity profiles in our study.",llama3.1:8b
HCC1937,breast,39507961,PMC11536251,[DDX5-Targeting Fragile X Mental Retardation Protein Regulates the Wnt/β-catenin Signaling Pathway to Promote Epithelial Mesenchymal Transition in Breast Cancer].,yes,https://pubmed.ncbi.nlm.nih.gov/39507961/,2026-04-20T20:57:19.548107+00:00,"This study investigates the role of FMRP in breast cancer (BC) progression, revealing that high expression of FMRP is associated with poor prognosis. The authors demonstrate that overexpression of FMRP promotes BC cell migration, invasion, and epithelial-to-mesenchymal transition (EMT), while knockdown of FMRP has the opposite effect. Furthermore, they identify DDX5 as a target of FMRP and show that FMRP promotes Wnt/β-catenin signaling pathway activation through targeting DDX5.",FMRP可能成为BC治疗与评估预后的潜在靶点。,llama3.1:8b
VP229,breast,NA,,No MYC-related papers found,NA,,2026-04-20T20:57:19.970894+00:00,,,
SUM1315MO2,breast,NA,,No MYC-related papers found,NA,,2026-04-20T20:57:20.474263+00:00,,,
ZR751,breast,25135691,PMC4155093,"Cephalotaxus griffithii Hook.f. needle extract induces cell cycle arrest, apoptosis and suppression of hTERT and hTR expression on human breast cancer cells.",yes,https://pubmed.ncbi.nlm.nih.gov/25135691/,2026-04-20T20:57:22.630686+00:00,"This study investigated the antiproliferative activity of extracts from C. griffithii needles on human malignant tumor cells. The results showed that the PE extract had the highest cytotoxic effect, inducing cell cycle arrest, apoptosis, and telomerase suppression in ZR751 cells.","The p53 protein is an essential molecule that arrests cells with damaged DNA in G2, allowing time for DNA repair before the cell tries to enter the M phase.",llama3.1:8b
MDAMB361,breast,23117580,PMC3528696,Modifying metabolically sensitive histone marks by inhibiting glutamine metabolism affects gene expression and alters cancer cell phenotype.,yes,https://pubmed.ncbi.nlm.nih.gov/23117580/,2026-04-20T20:57:26.672651+00:00,"Treatment of MDAMB361 cells with Compound 968 induced significant downregulation of MYC, along with other critical cancer-related genes.","The decrease in histone H3K4me3 at global and gene-specific levels correlated with reduced expression of SETD1 and ASH2L, genes encoding the histone H3K4 methyltransferase complex.",llama3.1:8b
MDAMB361,breast,26986571,PMC4811404,Anticancer effect of metformin on estrogen receptor-positive and tamoxifen-resistant breast cancer cell lines.,yes,https://pubmed.ncbi.nlm.nih.gov/26986571/,2026-04-20T20:57:27.487960+00:00,"Metformin inhibits ERα signaling in breast cancer cells, leading to reduced cell proliferation.","In conclusion, these results suggest that metformin exhibited a superior antiproliferative effect by inhibiting ERα signaling than tamoxifen in ERα-positive MCF-7, TR MCF-7 and MDA-MB-361 cells.",llama3.1:8b
MDAMB361,breast,11343771,,"Aberrations of chromosome 8 in 16 breast cancer cell lines by comparative genomic hybridization, fluorescence in situ hybridization, and spectral karyotyping.",no,https://pubmed.ncbi.nlm.nih.gov/11343771/,2026-04-20T20:57:27.489870+00:00,"[Abstract only] Extra copies of the C-MYC oncogene were found in 11 cell lines, including MDAMB361, but high-level amplification only in SK-BR-3.",,llama3.1:8b
HCC2218,breast,18408767,PMC3013056,"PCDH8, the human homolog of PAPC, is a candidate tumor suppressor of breast cancer.",yes,https://pubmed.ncbi.nlm.nih.gov/18408767/,2026-04-20T20:57:30.378054+00:00,The E146K mutant of PCDH8 sustained the expression of cyclin D1 and MYC without epidermal growth factor.,"Surprisingly, the E146K mutant transformed the human mammary epithelial cell line MCF10A and sustained the expression of cyclin D1 and MYC without epidermal growth factor.",llama3.1:8b
JIMT1,breast,34215226,PMC8254278,Breast cancer cell line toxicity of a flavonoid isolated from Baccharis densiflora.,yes,https://pubmed.ncbi.nlm.nih.gov/34215226/,2026-04-20T20:57:32.390013+00:00,"The study investigated the toxicity of three methoxyflavones isolated from B. densiflora, specifically 8-methoxycirsilineol, xanthomicrol, and sideritoflavone. The results showed that sideritoflavone was significantly more toxic than xanthomicrol, with an IC50 value of 1.9 μM in JIMT-1 cells.","The flavones 8-methoxycirsilineol, xanthomicrol, and sideritoflavone have similar structures but very different toxicity profiles in our study.",llama3.1:8b
