cell_line,tissue,pmid,pmcid,paper_title,is_free_access,paper_url,search_timestamp,myc_summary,direct_quote,model_used
NCIH211,lung,NA,,No MYC-related papers found,NA,,2026-04-20T20:41:29.075508+00:00,,,
LU99,lung,3089986,,Increased expression of the c-myc gene without gene amplification in human lung cancer and colon cancer cell lines.,no,https://pubmed.ncbi.nlm.nih.gov/3089986/,2026-04-20T20:41:30.090660+00:00,"[Abstract only] In LU99 cells, high levels of c-myc mRNA were observed due to increased transcriptional rate, not gene amplification.",The increased expression of c-myc in these cell lines...,llama3.1:8b
HCC827,lung,33858423,PMC8050891,Trichostatin A downregulates bromodomain and extra-terminal proteins to suppress osimertinib resistant non-small cell lung carcinoma.,yes,https://pubmed.ncbi.nlm.nih.gov/33858423/,2026-04-20T20:41:32.360849+00:00,"The study found that upregulation of BETs in osimertinib resistant cells may contribute to resistance to this drug. TSA and JQ1 showed strong growth-inhibitory effects on osimertinib resistant NSCLCs via downregulation of BET expression and BET activity, respectively.",We propose that acetylation of some proteins specifically enhanced by the EGFR signaling pathways (such as the C797S active mutation) may contribute to osimertinib resistance.,llama3.1:8b
HCC827,lung,35251351,PMC8895470,ATIC facilitates cell growth and migration by upregulating Myc expression in lung adenocarcinoma.,yes,https://pubmed.ncbi.nlm.nih.gov/35251351/,2026-04-20T20:41:33.357641+00:00,"ATIC promotes cell growth, migration, and invasion in lung adenocarcinoma (LUAD) by increasing Myc expression.",The findings of the present study may provide a possible novel diagnostic marker and treatment target for LUAD.,llama3.1:8b
HCC827,lung,36682147,,"Structure optimization, synthesis, and biological evaluation of 6-(2-amino-1H-benzo[d]imidazole-6-yl)-quinazolin-4(3H)-one derivatives as potential multi-targeted anticancer agents via Aurora A/ PI3K/BRD4 inhibition.",no,https://pubmed.ncbi.nlm.nih.gov/36682147/,2026-04-20T20:41:34.162775+00:00,[Abstract only] MYC not discussed for this cell line in this paper,,llama3.1:8b
HCC827,lung,38233864,PMC10795321,Transformation to small cell lung cancer is irrespective of EGFR and accelerated by SMAD4-mediated ASCL1 transcription independently of RB1 in non-small cell lung cancer.,yes,https://pubmed.ncbi.nlm.nih.gov/38233864/,2026-04-20T20:41:35.138546+00:00,"The study found that SCLC transformation from NSCLC is a common phenomenon, occurring in both EGFR mutant and wild-type patients. The transformation was associated with concurrent RB1 and TP53 alterations, as well as SMAD4 mutation, which promoted aggressive tumor behavior and induced NE phenotype.",SCLC transformation occurs regardless of EGFR mutation status/TKIs treatment and pathological type in NSCLC population.,llama3.1:8b
HCC827,lung,32987632,PMC7650563,Schlafen 12 Is Prognostically Favorable and Reduces C-Myc and Proliferation in Lung Adenocarcinoma but Not in Lung Squamous Cell Carcinoma.,yes,https://pubmed.ncbi.nlm.nih.gov/32987632/,2026-04-20T20:41:35.971286+00:00,"SLFN12 plays a role in lung cancer biology, particularly in LUAD but not LUSC.",Our results indicate that SLFN12 does play a role in lung cancer biology.,llama3.1:8b
HCC827,lung,31217928,PMC6556510,Long non-coding RNA FOXO1 inhibits lung cancer cell growth through down-regulating PI3K/AKT signaling pathway.,yes,https://pubmed.ncbi.nlm.nih.gov/31217928/,2026-04-20T20:41:36.841101+00:00,"This study investigates the role of lncFOXO1 in lung cancer, finding that it inhibits cell proliferation, migration, and invasion while promoting apoptosis. The mechanism involves down-regulation of the PI3K/AKT signaling pathway.","LncRNA, a by-product of RNA polymerase II transcription, is originally thought to be the “noise” of genome transcription without biological function.",llama3.1:8b
HCC827,lung,41584581,PMC12827083,Mebendazole inhibits PELI3-mediated ubiquitination of TRADD in non-small cell lung cancer cells.,yes,https://pubmed.ncbi.nlm.nih.gov/41584581/,2026-04-20T20:41:37.663757+00:00,"Mebendazole inhibits the E3 ubiquitin ligase function of PELI3, leading to stabilization of TRADD and decreased cellular viability in NSCLC cells.","Drug repurposing attracts much attention in cancer research. Mebendazole, a well-known anti-helminthic drug, has been tested with anti-tumor properties against colorectal cancer, adrenocortical cancer, melanoma, and glioma.",llama3.1:8b
HCC827,lung,31202256,PMC6868484,Role of FBXW7 in the quiescence of gefitinib-resistant lung cancer stem cells in EGFR-mutant non-small cell lung cancer.,yes,https://pubmed.ncbi.nlm.nih.gov/31202256/,2026-04-20T20:41:38.435522+00:00,"In HCC827 cells, FBXW7 targets c-MYC for ubiquitination to regulate quiescence. Low levels of c-MYC were observed in gefitinib-resistant persisters (GRPs) from both PC9 and HCC827 cells.","The GRPs from both PC9 and HCC827 cells expressed high levels of CD133 and FBXW7, but low levels of c-MYC.",llama3.1:8b
NCIH460,lung,40391177,PMC12087594,"Inhibition of Dormant Lung Cancer Cell Reactivation by Punica Granatum Peel and Dioscorea Nipponica: Involving MYC, SKP2 and p27.",yes,https://pubmed.ncbi.nlm.nih.gov/40391177/,2026-04-20T20:41:41.000172+00:00,"This study investigated the effects of Punica granatum peel (PGP) and Dioscorea Nipponica (DN) on dormant lung cancer cells. The results showed that PGP and DN inhibited DNA synthesis, cell cycle re-entry, and modulated key proteins involved in cell cycle regulation and dormancy maintenance.","Dormant tumor cells, characterized by low proliferative and metabolic activity, play a crucial role in cancer recurrence and therapy resistance.",llama3.1:8b
NCIH460,lung,38672078,PMC11048134,"Shrimp Lipids Inhibit Migration, Epithelial-Mesenchymal Transition, and Cancer Stem Cells via Akt/mTOR/c-Myc Pathway Suppression.",yes,https://pubmed.ncbi.nlm.nih.gov/38672078/,2026-04-20T20:41:41.871134+00:00,"This study investigated the potential health benefits of lipids derived from shrimp, particularly carotenolipids (CLs), in suppressing key factors associated with cancer progression and metastasis. The results showed that CLs inhibited the migration of human lung cancer cells by targeting epithelial-to-mesenchymal transition (EMT) and suppressed stemness markers CD133, CD44, and Sox2.","Targeting the process of EMT, which is associated with the migration and invasion of cancer cells, is an important strategy for developing new cancer therapies to treat metastasis.",llama3.1:8b
NCIH460,lung,35475399,PMC9208446,Sufentanil inhibits the proliferation and epithelial mesenchymal transition of lung cancer cells through Wnt/beta-catenin signaling pathway.,yes,https://pubmed.ncbi.nlm.nih.gov/35475399/,2026-04-20T20:41:42.692315+00:00,"Sufentanil inhibited the Wnt/β-catenin signaling pathway, which led to downregulation of β-catenin, c-Myc, and MMP2 protein expression in H460 and H1299 cells.","The protein expressions of β-catenin, c-Myc, and MMP2 of the H460 and H1299 cells were measured by western blot after 2 nM sufentanil treatment.",llama3.1:8b
NCIH460,lung,37377735,PMC10291098,Iron-mediated oxidative stress induces PD-L1 expression via activation of c-Myc in lung adenocarcinoma.,yes,https://pubmed.ncbi.nlm.nih.gov/37377735/,2026-04-20T20:41:43.607164+00:00,"The study found that high iron density within the tumor microenvironment (TME) is significantly correlated with PD-L1 expression in lung adenocarcinoma (LUAD) samples. Iron can promote PD-L1 expression through a redox-dependent mechanism involving c-Myc activation, leading to T cell inhibition.","Blocking PD-1/PD-L1 axis has shown a great potential to restore TILs from exhausted status and, thus, to eradicate cancer cells.",llama3.1:8b
NCIH460,lung,36305146,,Wogonin Restrains the Malignant Progression of Lung Cancer Through Modulating MMP1 and PI3K/AKT Signaling Pathway.,yes,https://pubmed.ncbi.nlm.nih.gov/36305146/,2026-04-20T20:41:45.176201+00:00,"Wogonin, a natural flavonoid compound, represses cancer cell growth and induces apoptosis in lung cancer cells by modulating MMP1 expression and the PI3K/AKT signaling pathway.",Wogonin can repress lung cancer cells' growth and metastatic potential and promote cell apoptosis via repressing MMP1 expression and modulating PI3K/AKT signaling pathway.,llama3.1:8b
NCIH460,lung,36142379,PMC9499473,Novel Planar Pt(II) Cyclometallated Cytotoxic Complexes with G-Quadruplex Stabilisation and Luminescent Properties.,yes,https://pubmed.ncbi.nlm.nih.gov/36142379/,2026-04-20T20:41:46.477385+00:00,"Nine novel cyclometallated metal complexes were synthesised in good yield and purity, showing strong evidence of QDNA stabilisation and promising cytotoxicity.","We believe that these novel complexes provide a new base complex to be fine-tuned, with their strong photoluminescence providing an advantage over other platinum(II) complexes currently being investigated for cancer therapy.",llama3.1:8b
NCIH460,lung,10445853,,Implication of c-Myc in apoptosis induced by the retinoid CD437 in human lung carcinoma cells.,no,https://pubmed.ncbi.nlm.nih.gov/10445853/,2026-04-20T20:41:46.478249+00:00,"[Abstract only] CD437 up-regulated c-Myc expression in NCIH460 cells, which was correlated with cellular susceptibilities to induction of apoptosis by CD437. The effects were mediated through the ODC inhibitor difluoromethylornithine and c-Myc antisense oligodeoxynucleotide.",These data indicate that c-Myc gene plays an important role in mediating CD437-induced apoptosis in human NSCLC cells.,llama3.1:8b
NCIH460,lung,27167001,PMC5085205,"A natural small molecule, catechol, induces c-Myc degradation by directly targeting ERK2 in lung cancer.",yes,https://pubmed.ncbi.nlm.nih.gov/27167001/,2026-04-20T20:41:47.656953+00:00,"The study investigated the effects of catechol on ERK2 kinase activity, cell cycle progression, and tumor growth in various mouse models. The results showed that catechol inhibited ERK2 activity, induced G1/S phase arrest, and reduced tumor volume in both allograft and xenograft mouse models.","The final refined atomic model contains ERK2 residues 7–357, no electron density was observed for the N- and C-terminus (residues 1–6 and 358–360) and a weak electron density was observed for residues 13–15 and 336–337.",llama3.1:8b
NCIH460,lung,29232581,,"Homo- and heteroleptic Pt(II) complexes of ONN donor hydrazone and 4-picoline: A synthetic, structural and detailed mechanistic anticancer investigation.",no,https://pubmed.ncbi.nlm.nih.gov/29232581/,2026-04-20T20:41:48.192832+00:00,"[Abstract only] In H460 cells treated with C2b and C3b, the expression of c-Myc levels decreased.","Moreover, qRT-PCR and western blotting analysis showed that H460 and HepG2 cells treated with C2b and C3b significantly increased the expression of p53, p63, p21, p15, Bax and decreased Bcl-2 and c-Myc levels.",llama3.1:8b
NCIH460,lung,31897183,PMC6924162,POLR1B is upregulated and promotes cell proliferation in non-small cell lung cancer.,yes,https://pubmed.ncbi.nlm.nih.gov/31897183/,2026-04-20T20:41:49.216966+00:00,"The study found that POLR1B, a subunit of RNA polymerase I, is highly expressed in lung cancer cell lines and plays a critical role in regulating lung cancer cell proliferation. Suppressing POLR1B expression inhibited the proliferation of lung cancer cells and induced apoptosis.","In conclusion, the present study identified that POLR1B may serve an important role in the regulation of lung cancer cell proliferation.",llama3.1:8b
NCIH460,lung,16235994,,"Inhibition of growth, induction of apoptosis and alteration of gene expression by tea polyphenols in the highly metastatic human lung cancer cell line NCI-H460.",no,https://pubmed.ncbi.nlm.nih.gov/16235994/,2026-04-20T20:41:49.217723+00:00,"[Abstract only] In the NCIH460 cell line, tea compounds had no significant influence on c-Myc expression.","Tea compounds upregulated expression of p53, downregulated expression of Bcl-2 but there was no significant influence on H-ras and c-Myc expressions.",llama3.1:8b
NCIH460,lung,16104505,,[Inhibition of proliferation and induction of apoptosis by tanshinone II A in NCI-H460 cell].,no,https://pubmed.ncbi.nlm.nih.gov/16104505/,2026-04-20T20:41:49.218284+00:00,"[Abstract only] In NCIH460 cells, tanshinone II A treatment notably decreased the expression of proto-onco gene C-myc.","The outcome of RT-PCR showed that the expression of proto-onco gene bcl-2 and C-myc was notably decrease, after cultured with tanshinone II A for 48 h.",llama3.1:8b
NCIH460,lung,37202187,PMC10202792,[High expression of MYH9 inhibits apoptosis of non-small cell lung cancer cells through activating the AKT/c-Myc pathway].,yes,https://pubmed.ncbi.nlm.nih.gov/37202187/,2026-04-20T20:41:50.020653+00:00,MYH9 contributes to NSCLC progression by inhibiting cell apoptosis via activating the AKT/c-Myc axis.,,llama3.1:8b
NCIH460,lung,34907714,,"Ethyl acetate extract of Clausena excavata induces growth inhibition of non-small-lung cancer, NCI-H460, cell line via apoptosis.",no,https://pubmed.ncbi.nlm.nih.gov/34907714/,2026-04-20T20:41:52.339396+00:00,"[Abstract only] In NCIH460 cells, EACE treatment decreased c-Myc gene expression after 48 h.","After 48 h treatment, EACE increased the pro-apoptotic BAX and decreased the anti-apoptotic Bcl-2, Survivin and c-Myc gene expressions.",llama3.1:8b
NCIH460,lung,15077166,,Cyr61 suppresses the growth of non-small-cell lung cancer cells via the beta-catenin-c-myc-p53 pathway.,no,https://pubmed.ncbi.nlm.nih.gov/15077166/,2026-04-20T20:41:52.340158+00:00,"[Abstract only] In NCIH460 cells, MYC is not discussed in this paper.",,llama3.1:8b
NCIH460,lung,29133054,,"Synthesis, crystal structure and biological evaluation of a new dasatinib copper(II) complex as telomerase inhibitor.",no,https://pubmed.ncbi.nlm.nih.gov/29133054/,2026-04-20T20:41:52.875023+00:00,"[Abstract only] The new complex (1) was found to target c-myc G-quadruplex DNA, likely inhibiting telomerase.","Experimental results from cell apoptosis analysis, cellular uptake, TRAP-silver staining assay, RT-PCR, western blot, and transfection assays showed that 1 was most likely a telomerase inhibitor that targeted c-myc G-quadruplex DNA.",llama3.1:8b
NCIH460,lung,30205260,,"Novel tacrine platinum(II) complexes display high anticancer activity via inhibition of telomerase activity, dysfunction of mitochondria, and activation of the p53 signaling pathway.",no,https://pubmed.ncbi.nlm.nih.gov/30205260/,2026-04-20T20:41:53.411972+00:00,"[Abstract only] Pt5 induced SK-OV3/DDP cell apoptosis via dysfunction of mitochondria, inhibition of the telomerase activity by directly targeting the c-myc promoter.","Pt5 induced SK-OV3/DDP cell apoptosis via dysfunction of mitochondria, inhibition of the telomerase activity by directly targeting the c-myc promoter, and activation of the p53 signaling pathway.",llama3.1:8b
NCIH460,lung,35452996,PMC9043980,Preclinical studies for improving radiosensitivity of non-small cell lung cancer cell lines by combining glutaminase inhibition and senolysis.,yes,https://pubmed.ncbi.nlm.nih.gov/35452996/,2026-04-20T20:41:54.412397+00:00,"This study investigated the relationship between glutaminolysis inhibition and radiosensitization in non-small cell lung cancer cells. The results showed that glutaminolysis inhibition enhanced radiation-induced senescence, which contributed to radiosensitization. Additionally, treatment with a senolytic drug increased apoptosis in radiation-induced senescent cells.",Glutaminolysis has been studied as a target for cancer therapy.,llama3.1:8b
NCIH460,lung,31496920,PMC6720419,CDK5 neutralizes the tumor suppressing effect of BIN1 via mediating phosphorylation of c-MYC at Ser-62 site in NSCLC.,yes,https://pubmed.ncbi.nlm.nih.gov/31496920/,2026-04-20T20:41:55.282831+00:00,"The study found that CDK5 overexpression in NSCLC cells blocks the interaction between BIN1 and c-MYC, leading to increased cell growth, invasion, and migration. The authors suggest that CDK5 could be a potential biomarker for predicting prognosis in NSCLC patients.",Aberrant phosphorylation of c-MYC at Ser-62 site could block the BIN1/c-MYC interaction.,llama3.1:8b
NCIH460,lung,20620131,,Anti-tumor effects by a synthetic chalcone compound is mediated by c-Myc-mediated reactive oxygen species production.,no,https://pubmed.ncbi.nlm.nih.gov/20620131/,2026-04-20T20:41:55.816501+00:00,"[Abstract only] In NCIH460 cells, TSHDC treatment did not result in increased ROS production due to low c-Myc levels.",,llama3.1:8b
HCC44,lung,35565305,PMC9099837,"EMT, Stemness, and Drug Resistance in Biological Context: A 3D Tumor Tissue/In Silico Platform for Analysis of Combinatorial Treatment in NSCLC with Aggressive KRAS-Biomarker Signatures.",yes,https://pubmed.ncbi.nlm.nih.gov/35565305/,2026-04-20T20:41:57.487372+00:00,"The study suggests that EMT is not a conclusive marker of KRAS independency, and combinatorial treatments should be considered for NSCLC patients.",Our combined in silico/in vitro results are proof of concept that a systematic understanding of the tumor cell-specific network and its different pathway dependencies on the biomarker signature are the key to a rational combinatorial targeted treatment.,llama3.1:8b
NCIH1792,lung,10445853,,Implication of c-Myc in apoptosis induced by the retinoid CD437 in human lung carcinoma cells.,no,https://pubmed.ncbi.nlm.nih.gov/10445853/,2026-04-20T20:41:58.382535+00:00,"[Abstract only] CD437 up-regulated c-Myc expression in NCIH1792 cells, which was correlated with cellular susceptibilities to induction of apoptosis by CD437. The effects were mediated through the ODC inhibitor difluoromethylornithine and c-Myc antisense oligodeoxynucleotide.",These data indicate that c-Myc gene plays an important role in mediating CD437-induced apoptosis in human NSCLC cells.,llama3.1:8b
NCIH2087,lung,NA,,No MYC-related papers found,NA,,2026-04-20T20:41:58.884190+00:00,,,
LK2,lung,NA,,No MYC-related papers found,NA,,2026-04-20T20:41:59.402295+00:00,,,
NCIH2887,lung,NA,,No MYC-related papers found,NA,,2026-04-20T20:41:59.907470+00:00,,,
NCIH82,lung,10523691,,A correlation of APC and c-myc mRNA levels in lung cancer cell lines.,no,https://pubmed.ncbi.nlm.nih.gov/10523691/,2026-04-20T20:42:01.079050+00:00,"[Abstract only] In NCIH82 cells, the c-myc/APC mRNA ratio was 127, indicating an inverse relationship between APC and c-myc mRNA levels.","Among the cell lines CaLu-3, NCI-H82, A427 and SW900 showed a very low level of APC mRNA and a high level of c-myc mRNA.",llama3.1:8b
NCIH82,lung,32698750,,lncRNAs as Potential Targets in Small Cell Lung Cancer: MYC -dependent Regulation.,yes,https://pubmed.ncbi.nlm.nih.gov/32698750/,2026-04-20T20:42:02.506652+00:00,Targeting MYC-regulated genes as a therapeutic strategy can be important for SCLC therapy.,This study indicated the importance of identifying MYC-regulated lncRNAs and that these can be utilized to develop a therapeutic strategy for SCLC.,llama3.1:8b
NCIH82,lung,35690961,5310991,Myc manipulates the miRNA content and biologic functions of small cell lung cancer cell-derived small extracellular vesicles.,yes,https://pubmed.ncbi.nlm.nih.gov/35690961/,2026-04-20T20:42:03.526170+00:00,"The paper discusses the development of a genetically engineered mouse model (GEMM) for small cell lung cancer (SCLC), which recapitulates the key clinical aspects of human SCLC. The GEMM, called RPM mice, expresses MYC and develops tumors with variant histopathology associated with high expression of NEUROD1.","Over 30 years ago, human SCLC cell lines with variant morphology were found to exhibit frequent MYC amplifications (Carney et al., 1985; Gazdar et al., 1985).",llama3.1:8b
NCIH82,lung,8934535,,Mechanism of all-trans-retinoic acid-mediated L-myc gene regulation in small cell lung cancer.,no,https://pubmed.ncbi.nlm.nih.gov/8934535/,2026-04-20T20:42:03.526985+00:00,"[Abstract only] In NCIH82 cells, RA treatment decreased c-myc gene expression while increasing L-myc gene expression in association with increased neuroendocrine differentiation.",Increases in steady-state levels of L-myc mRNA occurred in a dose-dependent manner after exposure to RA at a time-point prior to discernible changes in cellular morphology or growth.,llama3.1:8b
NCIH82,lung,11182068,,IFNalpha 2b induces apoptosis and proteasome-mediated degradation of p27Kip1 in a human lung cancer cell line.,no,https://pubmed.ncbi.nlm.nih.gov/11182068/,2026-04-20T20:42:03.527719+00:00,"[Abstract only] In NCIH82 cells, IFNalpha 2b treatment reduced c-myc protein levels.",The induction of apoptosis by IFNalpha 2b is accompanied by decreased levels of c-myc and Cdk2.,llama3.1:8b
NCIH82,lung,9688306,,"Delivery to cancer cells of antisense L-myc oligonucleotides incorporated in fusogenic, cationic-lipid-reconstituted influenza-virus envelopes (cationic virosomes).",no,https://pubmed.ncbi.nlm.nih.gov/9688306/,2026-04-20T20:42:03.528550+00:00,[Abstract only] MYC not discussed for this cell line in this paper,,llama3.1:8b
NCIH82,lung,7882365,,Inhibition of proliferation by L-myc antisense DNA for the translational initiation site in human small cell lung cancer.,no,https://pubmed.ncbi.nlm.nih.gov/7882365/,2026-04-20T20:42:03.529217+00:00,"[Abstract only] L-myc was overexpressed in NCIH82 cells, and its down-regulation inhibited cell proliferation.",,llama3.1:8b
NCIH82,lung,10074929,,Retinoic acid-mediated growth inhibition of small cell lung cancer cells is associated with reduced myc and increased p27Kip1 expression.,no,https://pubmed.ncbi.nlm.nih.gov/10074929/,2026-04-20T20:42:03.529910+00:00,"[Abstract only] RA treatment of H82 SCLC cells was associated with reduced c-myc expression, whereas ectopic expression of p27Kip1 induced growth inhibition in both H209 and H82 cells.","The RA-induced growth arrest of H82 SCLC cells, which express endogenous RAR-beta, was also associated with reduced c-myc and increased p27Kip1 expression.",llama3.1:8b
NCIH82,lung,15152945,,Cellular models of drug- and radiation-resistant small cell lung cancer.,no,https://pubmed.ncbi.nlm.nih.gov/15152945/,2026-04-20T20:42:03.530662+00:00,"[Abstract only] In NCIH82 cells, c-Myc expression was similar to that of the H69-EPR resistant subline for both c-myc and N-myc. Paclitaxel treatment tended to reverse resistance-associated changes in protein expression in these cells.","The H69-EPR and H69-CP resistant sublines were similar to the variant H82 cells for bcl-2, p21waf1, p53, N-myc and c-myc expression",llama3.1:8b
NCIH82,lung,8123593,,All-trans-retinoic acid alters myc gene expression and inhibits in vitro progression in small cell lung cancer.,no,https://pubmed.ncbi.nlm.nih.gov/8123593/,2026-04-20T20:42:03.531318+00:00,"[Abstract only] In NCIH82 cells, treatment with all-trans-retinoic acid decreased c-myc mRNA levels. Retinoic acid treatment prior to v-Ha-ras insertion also inhibited the typical ras-induced phenotypic transition seen in untreated NCIH82 cells.","These data show that all-trans-retinoic acid, a clinically relevant compound, inhibits small cell lung cancer progression in our in vitro model and alters the expression of the c-myc and L-myc oncogenes.",llama3.1:8b
NCIH82,lung,3004717,,Comparison of amplified and unamplified c-myc gene structure and expression in human small cell lung carcinoma cell lines.,no,https://pubmed.ncbi.nlm.nih.gov/3004717/,2026-04-20T20:42:03.531926+00:00,"[Abstract only] The NCIH82 cell line demonstrates 40- to 50-fold amplification of the c-myc gene, but expresses at least 250-fold more steady-state c-myc messenger RNA than an unamplified small cell lung cancer cell line (H378) with no detectable expression of c-myc. The chromatin structure of c-myc in H82 is similar to that in H378 and a B-lymphoblastoid cell line, despite extensive amplification of c-myc in H82.","Therefore, the predominant chromatin structural patterns do not appear to correlate with observed differences in gene expression.",llama3.1:8b
NCIH82,lung,34915142,,Antagonist G-targeted liposomes for improved delivery of anticancer drugs in small cell lung carcinoma.,no,https://pubmed.ncbi.nlm.nih.gov/34915142/,2026-04-20T20:42:04.068128+00:00,[Abstract only] An antisense oligodeoxynucleotide against the overexpressed oncogene c-myc was efficiently loaded into SALP formulations in NCIH82 cells.,"An antisense oligodeoxynucleotide against the overexpressed oncogene c-myc(as(c-myc)) was efficiently loaded into SALP formulations, the encapsulation efficiency decreased due to the inclusion of the targeting ligand.",llama3.1:8b
NCIH82,lung,10984118,,A combination treatment of c-myc antisense DNA with all-trans-retinoic acid inhibits cell proliferation by downregulating c-myc expression in small cell lung cancer.,no,https://pubmed.ncbi.nlm.nih.gov/10984118/,2026-04-20T20:42:04.069176+00:00,"[Abstract only] In NCIH82 cells, which overexpress c-MYC with gene amplification, c-myc antisense oligodeoxynucleoside phosphorothioate decreased c-myc expression by 40% and 20% in Northern and Western blot analyses, respectively. All-trans-RA also inhibited cell proliferation at the rate of 40% by downregulating c-myc expression. The combination of c-myc antisense OPT and all-trans-RA showed a greater inhibition of cell proliferation than either agent given alone through enhanced downregulation of c-myc expression.","This combination showed a greater inhibition of cell proliferation than either agent given alone (p < 0.01) (60% inhibition of cell growth compared with treatment of control scrambled or sense OPT alone, p < 0.01) through enhanced downregulation of c-myc expression.",llama3.1:8b
