cell_line,tissue,pmid,pmcid,paper_title,is_free_access,paper_url,search_timestamp,myc_summary,direct_quote,model_used
DLD1,colorectal,37513937,PMC10383422,"Cryptolepine Suppresses Colorectal Cancer Cell Proliferation, Stemness, and Metastatic Processes by Inhibiting WNT/β-Catenin Signaling.",yes,https://pubmed.ncbi.nlm.nih.gov/37513937/,2026-04-20T20:52:19.608157+00:00,"This paper investigates the effects of cryptolepine on colorectal cancer cells, specifically COLO205 and DLD1. The results show that cryptolepine reduces WNT3a-induced expression of WNT target genes and suppresses proliferation, stemness, and metastatic processes in CRC cells.","In conclusion, cryptolepine reduces WNT3a-induced expression of WNT target genes and suppresses the proliferation, stemness, and metastatic processes of CRC cells.",llama3.1:8b
DLD1,colorectal,30867802,PMC6396110,Inhibition of phosphodiesterase 4D decreases the malignant properties of DLD-1 colorectal cancer cells by repressing the AKT/mTOR/Myc signaling pathway.,yes,https://pubmed.ncbi.nlm.nih.gov/30867802/,2026-04-20T20:52:20.385218+00:00,"In DLD-1 CRC cells, cAMP/PDE4D signals serve a critical role in regulating Myc expression. Suppression of PDE4D using selective inhibitors increased intracellular cAMP levels, resulting in a marked decrease in the oncogenic properties of DLD-1 cells, including colony formation and cell proliferation.",It was demonstrated that cAMP/PDE4D signals serve a critical role in regulating Myc expression in DLD-1 CRC cells.,llama3.1:8b
DLD1,colorectal,1586975,,Posttranscriptional regulation of c-myc proto-oncogene expression and growth inhibition by recombinant human interferon-beta ser17 in a human colon carcinoma cell line.,no,https://pubmed.ncbi.nlm.nih.gov/1586975/,2026-04-20T20:52:20.386210+00:00,"[Abstract only] IFN-beta ser17 causes a time- and dose-dependent inhibition of c-myc expression in DLD-1 Clone A cells through posttranscriptional destabilization of c-myc mRNA, which is mediated by an increase in the activity of the 2',5'-oligoadenylate synthetase/RNase L pathway.",The suppression of c-myc expression mediated by IFN-beta ser17 is due to a posttranscriptional destabilization of c-myc mRNA rather than to an inhibition of c-myc mRNA transcription.,llama3.1:8b
DLD1,colorectal,27455418,PMC5036412,Methylglyoxal suppresses human colon cancer cell lines and tumor growth in a mouse model by impairing glycolytic metabolism of cancer cells associated with down-regulation of c-Myc expression.,yes,https://pubmed.ncbi.nlm.nih.gov/27455418/,2026-04-20T20:52:21.227671+00:00,MG treatment reduced c-Myc protein levels in DLD-1 colon cancer cells.,"Treatment with MG reduced glucose consumption, lactate production, and ATP production and decreased c-Myc protein levels in these cells.",llama3.1:8b
DLD1,colorectal,26807311,PMC4697677,Impact of prospero homeobox-1 on tumor cell behavior and prognosis in colorectal cancer.,yes,https://pubmed.ncbi.nlm.nih.gov/26807311/,2026-04-20T20:52:22.007476+00:00,MYC not discussed for this cell line in this paper,,llama3.1:8b
DLD1,colorectal,2660982,,Reversible suppression of c-myc expression in a human colon carcinoma line by the anticancer agent N-methylformamide.,no,https://pubmed.ncbi.nlm.nih.gov/2660982/,2026-04-20T20:52:22.008364+00:00,"[Abstract only] NMF suppresses the expression of the c-myc protooncogene in DLD-1 cells in a dose- and time-dependent manner, involving an inhibition of c-myc transcription.","This suppression involves an inhibition of c-myc transcription rather than an increased degradation of c-myc mRNA,",llama3.1:8b
DLD1,colorectal,28903410,PMC5589649,RASSF6 downregulation promotes the epithelial-mesenchymal transition and predicts poor prognosis in colorectal cancer.,yes,https://pubmed.ncbi.nlm.nih.gov/28903410/,2026-04-20T20:52:23.899284+00:00,"This paper investigates the role of RASSF6 in colorectal cancer (CRC) using various experimental approaches. The authors found that high expression of RASSF6 is associated with better prognosis and lower tumor recurrence rates in CRC patients. They also demonstrated that overexpression of RASSF6 inhibits cell proliferation, migration, and invasion in vitro and suppresses tumor growth and metastasis in vivo.",The specimens used for IHC were collected from 127 patients who were histologically and clinically diagnosed with colorectal cancer by The Third Affiliated Hospital of Southern Medical University between 2004 and 2010.,llama3.1:8b
DLD1,colorectal,37509438,PMC10376355,"2,3,5,4'-Tetrahydroxystilbene (TG1), a Novel Compound Derived from 2,3,5,4'-Tetrahydroxystilbene-2-O-β-D-glucoside (THSG), Inhibits Colorectal Cancer Progression by Inducing Ferroptosis, Apoptosis, and Autophagy.",yes,https://pubmed.ncbi.nlm.nih.gov/37509438/,2026-04-20T20:52:25.939377+00:00,"The study found that the compound TG1 has cytotoxic effects on colorectal cancer cells, inducing apoptosis, autophagy, and ferroptosis. The results suggest that TG1 may be a promising treatment alternative for colorectal cancer.","Over the past three decades, one-third of new FDA approved drugs were derived from natural products, and 74% were used for anticancer therapies.",llama3.1:8b
DLD1,colorectal,16875674,,Down-regulation of telomerase activity in DLD-1 human colorectal adenocarcinoma cells by tocotrienol.,no,https://pubmed.ncbi.nlm.nih.gov/16875674/,2026-04-20T20:52:25.940109+00:00,"[Abstract only] Tocotrienol inhibited protein kinase C activity, resulting in down-regulation of c-myc expression.","Tocotrienol inhibited protein kinase C activity, resulting in down-regulation of c-myc and human telomerase reverse transcriptase (hTERT) expression,",llama3.1:8b
DLD1,colorectal,16216547,,Polyunsaturated fatty acids inhibit telomerase activity in DLD-1 human colorectal adenocarcinoma cells: a dual mechanism approach.,no,https://pubmed.ncbi.nlm.nih.gov/16216547/,2026-04-20T20:52:25.940911+00:00,[Abstract only] EPA and DHA inhibited telomerase by down-regulating human telomerase reverse transcriptase (hTERT) and c-myc expression via protein kinase C inhibition.,These results indicate that PUFAs can directly inhibit the enzymatic activity of telomerase as well as modulate the telomerase at the transcriptional level.,llama3.1:8b
DLD1,colorectal,17409395,,PRL-3 down-regulates PTEN expression and signals through PI3K to promote epithelial-mesenchymal transition.,no,https://pubmed.ncbi.nlm.nih.gov/17409395/,2026-04-20T20:52:25.941792+00:00,[Abstract only] MYC not discussed for this cell line in this paper,,llama3.1:8b
T84,colorectal,26096932,PMC4820680,Integrin α1β1 expression is controlled by c-MYC in colorectal cancer cells.,yes,https://pubmed.ncbi.nlm.nih.gov/26096932/,2026-04-20T20:52:28.941339+00:00,"The study investigates the relationship between c-Myc expression and integrin alpha-1 (ITGA1) in human adenocarcinoma tissues. The results show a significant correlation between MYC and ITGA1 expression, suggesting that c-Myc may regulate ITGA1 transcription.",We used its promoter as a positive control and the primers were: forward 5′-GAAACTTGCACAGGGGTTGT-3′ and reverse 5′-GCCAAAGAATCTCAGCGACT-3′.,llama3.1:8b
T84,colorectal,11445004,,Expression of the Ca2+-activated chloride channel genes CLCA1 and CLCA2 is downregulated in human colorectal cancer.,no,https://pubmed.ncbi.nlm.nih.gov/11445004/,2026-04-20T20:52:28.942135+00:00,"[Abstract only] In normal colon epithelium, CLCA1 mRNA levels were significantly associated with c-myc transcription but became decoupled in the tumor samples.","Transcription of both genes in three colorectal cancer cell lines, T84, HT29, and Caco2, was barely detectable.",llama3.1:8b
T84,colorectal,23866118,PMC3725176,TNFα and IL-17 cooperatively stimulate glucose metabolism and growth factor production in human colorectal cancer cells.,yes,https://pubmed.ncbi.nlm.nih.gov/23866118/,2026-04-20T20:52:29.894383+00:00,"This paper investigates the mechanisms by which TNFα and IL-17 cooperate to promote colorectal carcinogenesis. The authors find that these cytokines stimulate glycolysis and growth factor production in human colorectal cancer cells, and that IL-17 enhances TNFα-stimulated production of a factor that increases proliferation/survival of fibroblastic cells.",The results presented here demonstrate that IL-17 synergizes with TNFα to stimulate the production by HT-29 cells of a factor that increases proliferation/survival of fibroblastic cells.,llama3.1:8b
T84,colorectal,29925347,PMC6011590,WDR5 supports colon cancer cells by promoting methylation of H3K4 and suppressing DNA damage.,yes,https://pubmed.ncbi.nlm.nih.gov/29925347/,2026-04-20T20:52:30.788521+00:00,WDR5 is highly overexpressed in colon cancer cells and is essential for colon cancer cell viability. Depletion of WDR5 sensitizes cells to irradiation.,WDR5 has been shown to physically interact with Myc and promote target recognition contributing to tumorigenesis.,llama3.1:8b
T84,colorectal,28933766,PMC5575599,Involvement of the Integrin α1β1 in the Progression of Colorectal Cancer.,yes,https://pubmed.ncbi.nlm.nih.gov/28933766/,2026-04-20T20:52:31.875245+00:00,"The study found that the integrin alpha-1 beta-1 is important for regulating the proliferation of colorectal tumor cells, as well as their migration and survival. The absence of this integrin was shown to induce significant tumor necrosis in xenograft models.","Indeed, if the RAS/MEK/ERK pathway is activated by α1β1, this could contribute to the stabilization of MYC by its phosphorylation by ERK, and MYC in turn would induce higher expression of the ITGA1 subunit.",llama3.1:8b
T84,colorectal,27856419,PMC5338605,Neuropeptide Y (NPY) promotes inflammation-induced tumorigenesis by enhancing epithelial cell proliferation.,yes,https://pubmed.ncbi.nlm.nih.gov/27856419/,2026-04-20T20:52:32.678991+00:00,"In T84 cells, NPY treatment increased c-Myc protein levels. This effect was part of the PI3-K/pAkt signaling pathway that promoted cell proliferation.","NPY-treated cells also displayed increased c-Myc and cyclin D1, and reduction in p21 (P < 0.05).",llama3.1:8b
SW837,colorectal,8376401,,Sodium butyrate causes an increase in the block to transcriptional elongation in the c-myc gene in SW837 rectal carcinoma cells.,no,https://pubmed.ncbi.nlm.nih.gov/8376401/,2026-04-20T20:52:33.730674+00:00,"[Abstract only] In SW837 cells, sodium butyrate treatment reduces c-myc RNA expression by increasing the block to transcriptional elongation. This effect is not due to decreased initiation or increased degradation of the RNA. A shift in relative usage of the two major promoters in the c-myc gene accompanies the reduction in expression.","We conclude that sodium butyrate induces an activity that increases the transcriptional block in SW837 cells, and that regulation of transcriptional elongation is an important mechanism for regulating c-myc expression in this cell type.",llama3.1:8b
SW837,colorectal,3078950,,Evidence for a labile intermediate in the butyrate induced reduction of the level of c-myc RNA in SW837 rectal carcinoma cells.,no,https://pubmed.ncbi.nlm.nih.gov/3078950/,2026-04-20T20:52:33.731797+00:00,"[Abstract only] In SW837 cells, butyric acid treatment caused a rapid decline in the level of myc RNA, which was dose-dependent and maximal at 1 mM. This effect was blocked by inhibitors of protein synthesis and reversed by removing the inducer.",This suggests that butyrate causes the induction of a labile activity that has a negative effect on myc RNA abundance.,llama3.1:8b
SW837,colorectal,36908321,PMC9994054,Potent bromodomain and extraterminal domain inhibitor JAB-8263 suppresses MYC expression and exerts anti-tumor activity in colorectal cancer models.,yes,https://pubmed.ncbi.nlm.nih.gov/36908321/,2026-04-20T20:52:34.681317+00:00,The BET inhibitor JAB-8263 can inhibit CRC cells mainly by inhibiting the expression of c-MYC.,"BET proteins are an important target in solid tumors, hematologic tumors and myelofibrosis. The development of BET small-molecule inhibitors has promising therapeutic value.",llama3.1:8b
SW837,colorectal,7642726,,Influence of protein tyrosine phosphorylation on the expression of the c-myc oncogene in cancer of the large bowel.,no,https://pubmed.ncbi.nlm.nih.gov/7642726/,2026-04-20T20:52:34.682029+00:00,"[Abstract only] In SW837 cells, inhibition of protein tyrosine kinase activity caused a decrease in c-myc expression. Genistein and geldanamycin also decreased the expression of c-myc RNA.",The most likely interpretation is that inhibition of protein tyrosine kinase activity caused a decrease in c-myc expression in these cells.,llama3.1:8b
SW837,colorectal,20841488,PMC2955796,Transcriptional attenuation in colon carcinoma cells in response to butyrate.,yes,https://pubmed.ncbi.nlm.nih.gov/20841488/,2026-04-20T20:52:35.580510+00:00,"The study found that butyrate induces transcriptional attenuation of the cyclin D1 and c-myc genes in colon cancer cells, leading to decreased expression of these oncogenes. The effects of butyrate on chromatin remodeling and histone modification are complex and may be independent of its HDAC inhibitory activity.","Our results demonstrate that this is the case for the effects of the short-chain fatty acid butyrate, and identify gene targets regulated by this mechanism.",llama3.1:8b
HT55,colorectal,NA,,No MYC-related papers found,NA,,2026-04-20T20:52:35.999324+00:00,,,
SNU407,colorectal,NA,,No MYC-related papers found,NA,,2026-04-20T20:52:37.137160+00:00,,,
SW403,colorectal,16899113,PMC1560159,Down-regulation of c-Myc following MEK/ERK inhibition halts the expression of malignant phenotype in rhabdomyosarcoma and in non muscle-derived human tumors.,yes,https://pubmed.ncbi.nlm.nih.gov/16899113/,2026-04-20T20:52:39.140732+00:00,"The paper discusses the role of c-Myc in the expression of transformed phenotype in muscle and non-muscle derived cell lines. The authors show that disruption of the c-Myc pathway impairs the expression of transformed phenotype, inducing myogenic differentiation in RD cells.",Our data provide evidence that the cooperation between MEK/ERK and c-Myc pathways play a major role in the expression of transformed phenotype in muscle and non-muscle-derived transformed cell lines.,llama3.1:8b
SW403,colorectal,30238564,PMC6272098,"RK-287107, a potent and specific tankyrase inhibitor, blocks colorectal cancer cell growth in a preclinical model.",yes,https://pubmed.ncbi.nlm.nih.gov/30238564/,2026-04-20T20:52:41.069826+00:00,"The paper discusses the development of a tankyrase inhibitor, RK-287107, which targets the beta-catenin signaling pathway. The results show that RK-287107 suppresses tumor growth in human colorectal cancer cells in mouse xenograft models with either i.p. or oral administration.","Meanwhile, no body weight alterations or histological changes in the small intestine in mice have been observed on 21-day oral dosage of JW55, a tankyrase-specific inhibitor.",llama3.1:8b
SW403,colorectal,36808265,2772987,Novel read through agent: ZKN-0013 demonstrates efficacy in APCmin model of familial adenomatous polyposis.,yes,https://pubmed.ncbi.nlm.nih.gov/36808265/,2026-04-20T20:52:43.189243+00:00,"Familial adenomatous polyposis (FAP) is a genetic disorder characterized by the development of multiple polyps in the colon and rectum, leading to an increased risk of colorectal cancer. The management of FAP involves regular screening and surveillance, as well as surgical interventions such as colectomy and ileorectal anastomosis. Chemoprevention with celecoxib has been shown to reduce the number of polyps in individuals with FAP.","The reduction in polyp burden, versus placebo, was significant (*P = 0.003) with the dosage of 400 mg twice a day (data for figure derived from reference [107]).",llama3.1:8b
HCT15,colorectal,35559417,PMC9091092,"PNMA5 accelerated cellular proliferation, invasion and migration in colorectal cancer.",yes,https://pubmed.ncbi.nlm.nih.gov/35559417/,2026-04-20T20:52:46.195872+00:00,PNMA5 expression was found to be positively associated with the expression of C-myc in colorectal cancer tissues.,"In addition, knockdown of PNMA5 expression decreased the proliferation, invasion and migration of both HCT-15 and HCT-116 cells.",llama3.1:8b
HCT15,colorectal,40082673,PMC11958781,KLF6-mediated recruitment of the p300 complex enhances H3K23su and cooperatively upregulates SEMA3C with FOSL2 to drive 5-FU resistance in colon cancer cells.,yes,https://pubmed.ncbi.nlm.nih.gov/40082673/,2026-04-20T20:52:47.122675+00:00,"This study investigates the role of histone post-translational modifications, specifically lysine succinylation, in regulating gene transcription and modulating key signaling cascades implicated in oncogenesis. The authors identify a collaborative mechanism between KLF6, TAF6L, and FOSL2 that enhances chromatin accessibility and promotes the upregulation of SEMA3C, which in turn stimulates the Wnt-β-catenin/TCF1 pathway and fosters resistance to 5-FU in HCT15-FR cells.",Histone succinylation has been implicated in the regulation of transcription and tumor development.,llama3.1:8b
HCT15,colorectal,28950657,,The BET-Bromodomain Inhibitor JQ1 synergized ABT-263 against colorectal cancer cells through suppressing c-Myc-induced miR-1271-5p expression.,no,https://pubmed.ncbi.nlm.nih.gov/28950657/,2026-04-20T20:52:47.740455+00:00,"[Abstract only] In HCT15 cells, c-Myc transcriptionally activates miR-1271-5p, which inhibits Noxa protein production. The combination treatment of JQ1 and ABT-263 inhibited c-Myc protein level, leading to increased Noxa protein levels and Mcl-1 degradation.","The combination treatment of JQ1 and ABT-263 inhibited c-Myc protein level and also c-Myc-driven expression of miR-1271-5p,",llama3.1:8b
HCT15,colorectal,30338942,PMC6307779,MiR-30-5p suppresses cell chemoresistance and stemness in colorectal cancer through USP22/Wnt/β-catenin signaling axis.,yes,https://pubmed.ncbi.nlm.nih.gov/30338942/,2026-04-20T20:52:48.724879+00:00,"This study investigates the role of miR-30-5p in regulating colorectal cancer (CRC) stemness and chemoresistance. The results show that miR-30-5p targets the USP22/Wnt/β-catenin signaling axis, reducing CRC phenotypic severity.",Stemness and chemoresistance are two major barriers to advancing CRC treatment regimens and represent the most pressing limitation for curing advanced disease.,llama3.1:8b
HCT15,colorectal,21531700,PMC3159436,Coordinated regulation of mitochondrial topoisomerase IB with mitochondrial nuclear encoded genes and MYC.,yes,https://pubmed.ncbi.nlm.nih.gov/21531700/,2026-04-20T20:52:49.608478+00:00,"The study found that MYC is a master regulator of TOP1MT and mtDNA enzymes, and that the mitochondrial transcriptome of cancer cells acts as a highly coordinated ensemble of genes under the control of master regulators like MYC.","Our comparative genomic approach is different from what previously published using limited number of cell lines in individual experiments. Here, we studied the convergence of gene expressions of a wide range of cell lines, analyzed in their basal condition.",llama3.1:8b
HCT15,colorectal,29267898,,"A polymorphic MYC response element in KBTBD11 influences colorectal cancer risk, especially in interaction with an MYC-regulated SNP rs6983267.",no,https://pubmed.ncbi.nlm.nih.gov/29267898/,2026-04-20T20:52:50.168563+00:00,"[Abstract only] In HCT15 cells, MYC expression was increased by rs6983267 T > G, leading to negative regulation of KBTBD11 expression when the rs11777210 C risk allele was present.","rs6983267 T > G increased MYC expression,",llama3.1:8b
HCT15,colorectal,28223542,PMC5410330,The in vitro and vivo effects of nuclear and cytosolic parafibromin expression on the aggressive phenotypes of colorectal cancer cells: a search of potential gene therapy target.,yes,https://pubmed.ncbi.nlm.nih.gov/28223542/,2026-04-20T20:52:51.058629+00:00,"The paper discusses the role of parafibromin in colorectal cancer, including its expression levels, cellular localization, and association with clinical parameters. The study also investigates the relationship between parafibromin and other biomarkers, such as Ki-67, and examines the potential therapeutic implications of targeting parafibromin.",The alignment data was utilized to calculate distribution of reads on reference genes and mapping ratio.,llama3.1:8b
HCT15,colorectal,24118446,PMC7653517,Amurensin G enhances the susceptibility to tumor necrosis factor-related apoptosis-inducing ligand-mediated cytotoxicity of cancer stem-like cells of HCT-15 cells.,yes,https://pubmed.ncbi.nlm.nih.gov/24118446/,2026-04-20T20:52:51.839057+00:00,"In CD44+ HCT-15 cells, increased levels of death receptors DR4 and DR5 as well as c-Myc were observed compared to CD44- HCT-15 cells.","CD44+ HCT-15 cells were more susceptible to TRAIL-mediated cytotoxicity than CD44- HCT-15 cells, possibly due to increased levels of death receptors DR4 and DR5 as well as c-Myc, and decreased levels of c-FLIP_L/S in CD44+ cells compared with CD44- HCT-15 cells.",llama3.1:8b
HCT15,colorectal,10660115,,Differential effects of retinoic acid on growth and apoptosis in human colon cancer cell lines associated with the induction of retinoic acid receptor beta.,no,https://pubmed.ncbi.nlm.nih.gov/10660115/,2026-04-20T20:52:51.839990+00:00,"[Abstract only] In HCT15 cells, RA treatment did not directly discuss MYC functions. However, RARbeta transfectants of DLD-1 expressed an enhanced level of c-Myc protein.",,llama3.1:8b
HCT15,colorectal,29925347,PMC6011590,WDR5 supports colon cancer cells by promoting methylation of H3K4 and suppressing DNA damage.,yes,https://pubmed.ncbi.nlm.nih.gov/29925347/,2026-04-20T20:52:52.746683+00:00,WDR5 is highly overexpressed in colon cancer cells and is essential for colon cancer cell viability. Depletion of WDR5 sensitizes cells to irradiation.,"Our data demonstrate that, in colon cancer, WDR5 depletion induced a robust increase in γH2AX levels representative of an increase in DNA damage.",llama3.1:8b
HCT15,colorectal,39197803,,Jiedu Xiaozheng Yin extract targets cancer stem cells by Wnt signaling pathway in colorectal cancer.,no,https://pubmed.ncbi.nlm.nih.gov/39197803/,2026-04-20T20:52:53.283261+00:00,"[Abstract only] JXY extract downregulated C-MYC in HCT-15 cells, as well as other Wnt pathway target proteins including Cyclin D1.","Furthermore, JXY extract inhibited spheroid formation in CRC cells and downregulated CRC CSC markers (CD133, DCLK1, and C-MYC).",llama3.1:8b
HCT15,colorectal,35619550,PMC9288490,Melatonin and andrographolide synergize to inhibit the colospheroid phenotype by targeting Wnt/beta-catenin signaling.,yes,https://pubmed.ncbi.nlm.nih.gov/35619550/,2026-04-20T20:52:54.256976+00:00,"The study investigates the combination of melatonin (MLT) and agomelatine (AGP) in treating colorectal cancer (CRC). The results show that this combination decreases stemness properties through CD44, CD133, Nanog, Sox2, and Oct4 inhibition. It also inhibits several β-catenin target proteins, similar to the Wnt/β-catenin inhibitor PRI-724.",The effective concentration of MLT is greatly reduced when combined with AGP.,llama3.1:8b
HCT15,colorectal,39061234,PMC11274566,Fibroblasts Promote Resistance to KRAS Silencing in Colorectal Cancer Cells.,yes,https://pubmed.ncbi.nlm.nih.gov/39061234/,2026-04-20T20:52:55.219583+00:00,"The study found that cancer-associated fibroblasts (CAFs) can mediate resistance to KRAS inhibitors in colorectal cancer by promoting the expression of stem cell markers, EMT, and tumor development pathways.","Our data opens the door for future studies addressing the effects of combining NOTCH inhibitors, such as gamma-secretase inhibitors, with KRAS-targeting therapies as a strategy to mitigate CAF-induced stemness and resistance to KRAS inhibitors.",llama3.1:8b
HCT15,colorectal,30675309,PMC6341844,Effects of Beclin 1 overexpression on aggressive phenotypes of colon cancer cells.,yes,https://pubmed.ncbi.nlm.nih.gov/30675309/,2026-04-20T20:52:55.994867+00:00,Beclin 1 overexpression increased expression of c-Myc in HCT-15 cells as determined using the reverse transcription-quantitative polymerase chain reaction (P<0.05).,"The two transfectants exhibited increased expression of c-Myc, cyclin D1, β-catenin, insulin-response element 1 and 78 kDa glucose-regulated protein compared with the control and mock cells as determined using the reverse transcription-quantitative polymerase chain reaction (P<0.05).",llama3.1:8b
HCT15,colorectal,21284881,PMC3038146,Mechanisms of confluence-dependent expression of CD26 in colon cancer cell lines.,yes,https://pubmed.ncbi.nlm.nih.gov/21284881/,2026-04-20T20:52:57.960863+00:00,"The study found that CD26 expression is increased in colon carcinoma lines grown to confluence, associated with changes in selected transcription factors. The authors suggest that c-Myc expression decreases with confluence and can act as a repressor of CD26 expression.","In the present study, we demonstrate that CD26 expression is increased in colon carcinoma lines grown to confluence, associated with changes in selected transcription factors.",llama3.1:8b
HCT15,colorectal,21370894,,Cytotoxic and antineoplastic activity of timosaponin A-III for human colon cancer cells.,no,https://pubmed.ncbi.nlm.nih.gov/21370894/,2026-04-20T20:52:58.457674+00:00,"[Abstract only] In HCT15 cells, timosaponin A-III down-regulated c-Myc protein levels, which was correlated with cell-cycle arrest.","Cell-cycle arrest in the G0/G1 and G2/M phase by 1 was correlated with the down-regulation of cyclin A, cyclin B1, CDK2, CDK4, proliferating cell nuclear antigen, and c-Myc.",llama3.1:8b
